{
  "schema_version": 1,
  "cues": [
    {
      "id": "power-pickup",
      "file": "audio/power_pickup.wav"
    },
    {
      "id": "traffic-warning",
      "file": "audio/traffic_warning.wav"
    },
    {
      "id": "decision-wait",
      "file": "audio/decision_wait.wav"
    },
    {
      "id": "decision-clear",
      "file": "audio/decision_clear.wav"
    },
    {
      "id": "mission-complete",
      "file": "audio/relay_restored.wav"
    },
    {
      "id": "collision",
      "file": "audio/collision.wav"
    },
    {
      "id": "payload-collected",
      "file": "audio/harvest_pickup.wav"
    },
    {
      "id": "task-abandoned",
      "file": "audio/task_abandoned.wav"
    },
    {
      "id": "payload-damaged",
      "file": "audio/fruit_damage.wav"
    }
  ],
  "events": [
    {
      "codes": [
        "via-reached"
      ],
      "cue": "power-pickup",
      "cooldown_s": 0.0
    },
    {
      "codes": [
        "item-collected"
      ],
      "cue": "payload-collected",
      "cooldown_s": 0.0
    },
    {
      "codes": [
        "task-abandoned"
      ],
      "cue": "task-abandoned",
      "cooldown_s": 0.0
    },
    {
      "codes": [
        "payload-damage"
      ],
      "cue": "payload-damaged",
      "cooldown_s": 0.0
    },
    {
      "codes": [
        "dynamic-detected",
        "emergency-escape"
      ],
      "cue": "traffic-warning",
      "cooldown_s": 3.0
    },
    {
      "codes": [
        "mission-complete"
      ],
      "cue": "mission-complete",
      "cooldown_s": 0.0
    },
    {
      "codes": [
        "collision-static",
        "collision-dynamic",
        "rollover"
      ],
      "cue": "collision",
      "cooldown_s": 0.0
    }
  ],
  "decision_transition": {
    "action_code": "wait",
    "enter_cue": "decision-wait",
    "exit_cue": "decision-clear",
    "exit_stable_s": 0.8
  }
}
